<?xml version="1.0" encoding="UTF-8"?>
<?xml-stylesheet type="text/xsl" href="td-00.xslt"?>
<td xmlns="urn:ietf:rfc:9999" xmlns:xs="http://www.w3.org/2001/XMLSchema" xmlns:xsi="http://www.w3.org/2001/XMLSchema-instance" xsi:schemaLocation="urn:ietf:rfc:9999 td-00.xsd" hreft="http://www.example.com/feed{?pagesize,page}">
   <variable name="pagesize" concept-uri="http://example.com/feedpaging/pagesize">
      <restriction base="positiveInteger">
         <minInclusive value="5"/>
         <maxInclusive value="100"/>
      </restriction>
      <documentation xml:lang="en">Number of returned items per page.</documentation>
   </variable>
   <variable name="page" concept-uri="http://example.com/feedpaging/page">
      <restriction base="positiveInteger"/>
      <documentation xml:lang="en">Page number of the returned page (based on the requested pagesize or a server-configured default).</documentation>
   </variable>
   <documentation xml:lang="en">Template for accessing a paged feed of entries at http://www.example.com/feed, with client controls for the page size, and the returned page.</documentation>
</td>